{
  "schema_version": "0.3.0",
  "id": "trap.data-import.watermarks-need-committed-side-effect-evidence",
  "record_type": "trap",
  "record_version": 1,
  "created_at": "2026-06-13T00:00:00+09:00",
  "updated_at": "2026-06-13T00:00:00+09:00",
  "supersedes": [],
  "superseded_by": [],
  "title": "Import watermarks need committed side-effect evidence",
  "status": "reviewed",
  "domain": "data-import",
  "tags": [
    "batch-jobs",
    "common-ai-mistake",
    "data-import",
    "idempotency",
    "safe-recovery",
    "verification"
  ],
  "summary": "An import watermark or success marker should advance only from committed side effects. Audit rows and progress evidence must not become resume truth until the durable write they describe has actually succeeded.",
  "ai_value": "Helps agents distinguish in-flight progress, audit visibility, committed watermarks, and external acknowledgements when repairing imports or retries.",
  "applies_to": {
    "ecosystem": "agent operations and software delivery",
    "contexts": [
      "incremental imports maintain watermarks, cursors, audit rows, or progress tables",
      "a partial run wrote evidence rows but failed during the downstream side effect",
      "uniform downstream exceptions make agents suspect the upstream provider first"
    ],
    "tools": [
      {
        "name": "general agent workflow",
        "version_range": "de-identified operational pattern",
        "observed_versions": [
          "2026-06-13 AI-reviewed publication batch"
        ]
      }
    ]
  },
  "trigger_signals": [
    {
      "description": "A watermark advances before the destination mutation commits.",
      "agent_interpretation": "Treat the watermark as unsafe; separate in-flight cursor from committed lower bound.",
      "detectable_by": [
        "job code",
        "transaction order",
        "audit table"
      ]
    },
    {
      "description": "Evidence rows are written before the side effect they claim to prove.",
      "agent_interpretation": "Make those rows attempt/audit state only, not resume state.",
      "detectable_by": [
        "database probe",
        "job logs"
      ]
    },
    {
      "description": "A whole batch fails with the same downstream exception class after source reads succeed.",
      "agent_interpretation": "Investigate the local side-effect path before assuming an upstream outage.",
      "detectable_by": [
        "logs",
        "exception summary",
        "retry report"
      ]
    }
  ],
  "negative_signals": [
    {
      "description": "The destination operation is atomic with the watermark update in one durable transaction.",
      "why_it_matters": "The completion boundary may already be correct, though external acknowledgements still need review."
    },
    {
      "description": "The progress evidence is explicitly labelled attempt-only and never read by resume logic.",
      "why_it_matters": "Attempt logs can be useful without becoming committed state."
    }
  ],
  "common_wrong_assumptions": [
    "If source reads succeeded, the import can advance the watermark.",
    "Audit rows are harmless even when resume logic later reads them as truth.",
    "A uniform exception across the batch must mean the upstream system is down."
  ],
  "first_checks": [
    {
      "check": "Trace the order of source read, destination write, audit/progress write, watermark advance, and external acknowledgement.",
      "why": "The committed side effect must be the boundary for success.",
      "files": [
        "job runner",
        "transaction code",
        "audit schema"
      ],
      "safe_to_run": true
    },
    {
      "check": "Probe a failed run and verify whether its rows can influence future resume lower bounds.",
      "why": "Failed attempts should be visible but not promoted automatically.",
      "files": [
        "progress table",
        "watermark table"
      ],
      "safe_to_run": true
    },
    {
      "check": "Classify exception uniformity before retrying.",
      "why": "Uniform local exceptions usually require code/config repair, not upstream backoff.",
      "files": [
        "logs",
        "error summary"
      ],
      "safe_to_run": true
    }
  ],
  "decision_rules": [
    {
      "confidence": "medium",
      "source_ids": [
        "batch0613-publication-batch-18-2026-06-13"
      ],
      "condition": "A watermark, lower bound, or success marker advances before durable destination commit.",
      "action": "modify_code",
      "action_detail": "advance_watermark_after_commit_only",
      "then": "Move the state transition after the committed side effect and keep in-flight cursors separate."
    },
    {
      "confidence": "medium",
      "source_ids": [
        "batch0613-publication-batch-18-2026-06-13"
      ],
      "condition": "Failed attempt evidence exists but is not safe for resume.",
      "action": "diagnose",
      "action_detail": "mark_attempt_only_until_promoted",
      "then": "Keep it visible for audit while excluding it from resume selection unless a reviewed repair promotes it."
    },
    {
      "confidence": "medium",
      "source_ids": [
        "batch0613-publication-batch-18-2026-06-13"
      ],
      "condition": "Uniform downstream exceptions appear after successful source reads.",
      "action": "diagnose",
      "action_detail": "triage_local_side_effect_path_first",
      "then": "Inspect local destination schema, permissions, serialization, and transaction boundaries before broad upstream retries."
    }
  ],
  "do_not": [
    "Do not let failed-run cursors become committed watermarks by accident.",
    "Do not acknowledge external notifications before the local persistence contract is satisfied; see webhook-ack-layer-and-auth-identity.",
    "Do not hide partial attempts; make them audit-visible but not authoritative.",
    "Do not use committed side-effect evidence as a substitute for persisted cursor-key design; cross-check progress-state-must-match-cursor-semantics when modes/windows can overwrite progress state."
  ],
  "agent_directives": {
    "do_not_auto_apply": true,
    "preferred_next_step": "Trace the import state transitions and ensure only committed destination effects can advance resume or watermark truth."
  },
  "risk": {
    "level": "medium",
    "human_gate_required": false,
    "notes": "This record is de-identified agent guidance. It does not authorize bypassing maintainer, security, publication, production, billing, data, permission, or destructive-action gates."
  },
  "evidence": {
    "sources": [
      {
        "id": "batch0613-publication-batch-18-2026-06-13",
        "url": "verification-artifact:batch0613-publication-batch-18-2026-06-13",
        "type": "verification_artifact",
        "retrieved_at": "2026-06-13T00:00:00+09:00",
        "supports": "Item 18 residual was selected as standalone; ACK-after-persist was moved into the webhook acknowledgement record."
      }
    ],
    "verification_runs": []
  },
  "freshness": {
    "checked_at": "2026-06-13",
    "volatility": "medium",
    "next_check_due": "2026-12-13"
  }
}
